Otázka,Správná o.,Špatná o. 1,Špatná o. 2,Špatná o. 3
Jaký je název knihy německého spisovatele Ericha Maria Remarqua o první světové válce?,Na západní frontě klid,Přátelství,Odysseus,Do zbraně, do války
Která z těchto knih není dílem Ericha Maria Remarqua?,Válka a mír,Na západní frontě klid,Tři kamarádi,Čas žít a čas umírat
Jak se jmenuje hlavní postava knihy Tři kamarádi od Ericha Maria Remarqua?,Robert Lohkamp,Paul Baumer,Victor Frankenstein,Leopold Bloom
V jakém roce byla vydána kniha Čas žít a čas umírat?,1954,1945,1931,1960
Jaký je název knihy, kterou napsal Remarque o svém exilu v USA?,Tři kamarádi,Vítězný oblouk,Země nikoho,Na dalekém západě
Jaký byl Erich Maria Remarque za život?,Spisovatel,Hercegovenec,Obchodník,Právník
Která z těchto věcí není často zdůrazňována v dílech Remarqua?,Národnostní hrdost,Humanismus,Antifašismus,Pacifismus
V jakém roce zemřel Erich Maria Remarque?,1970,1980,1990,2000
Jaký je název knihy, kterou Remarque napsal o německé emigraci během nacistické éry?,Země nikoho,Vítězný oblouk,Trýznivé ticho,Sestřelený anděl